[
  {
    "effective_patch": null,
    "fetched_at": "2026-08-14T10:19:09Z",
    "game_build_id": 205505,
    "id": 7,
    "kind": "specialization",
    "mode": "wvw",
    "names": {
      "en": "Daredevil",
      "zh": "独行侠"
    },
    "payload": {
      "background": "https://render.guildwars2.com/file/B969F9B27EE82CBF0E4651FD0F760F702CB5FCED/1012101.png",
      "elite": true,
      "icon": "https://render.guildwars2.com/file/F1985D4E1CE043D7145E030C0AC4CFDABED73A59/1012025.png",
      "major_traits": [
        1933,
        2023,
        1949,
        1884,
        1893,
        1975,
        1833,
        1964,
        2047
      ],
      "minor_traits": [
        1994,
        1887,
        1837
      ],
      "profession": "Thief",
      "profession_icon": "https://render.guildwars2.com/file/CEA6755F350FAAE9A7D8796CF8CC10FA1E33081D/1128571.png",
      "profession_icon_big": "https://render.guildwars2.com/file/232D31C9A3076F6A6B41167FBDA7D50F70C82260/1128570.png",
      "weapon_trait": 1957
    },
    "source_refs": [
      "arenanet-api:specializations:7"
    ],
    "verification_status": "automated"
  },
  {
    "effective_patch": null,
    "fetched_at": "2026-08-14T10:19:09Z",
    "game_build_id": 205505,
    "id": 20,
    "kind": "specialization",
    "mode": "wvw",
    "names": {
      "en": "Shadow Arts",
      "zh": "暗影"
    },
    "payload": {
      "background": "https://render.guildwars2.com/file/6943976957615E2337BE6B38292BAEB23C2BAAB9/1012103.png",
      "elite": false,
      "icon": "https://render.guildwars2.com/file/B62E5512754BEB1D0116B1DB3B6FA0ECA4DD630C/1012027.png",
      "major_traits": [
        1160,
        1293,
        1284,
        1297,
        1130,
        1300,
        1134,
        1135,
        1162
      ],
      "minor_traits": [
        1294,
        1136,
        1705
      ],
      "profession": "Thief"
    },
    "source_refs": [
      "arenanet-api:specializations:20"
    ],
    "verification_status": "automated"
  },
  {
    "effective_patch": null,
    "fetched_at": "2026-08-14T10:19:09Z",
    "game_build_id": 205505,
    "id": 28,
    "kind": "specialization",
    "mode": "wvw",
    "names": {
      "en": "Deadly Arts",
      "zh": "武艺"
    },
    "payload": {
      "background": "https://render.guildwars2.com/file/2AA7FB65630AD540E204982978DA9601023B540E/1012102.png",
      "elite": false,
      "icon": "https://render.guildwars2.com/file/38F6FA9A5D04CEC605AF6E5D994119281A38A9FA/1012026.png",
      "major_traits": [
        1245,
        1276,
        1164,
        1169,
        1292,
        1704,
        1291,
        1167,
        1269
      ],
      "minor_traits": [
        1279,
        1280,
        1257
      ],
      "profession": "Thief"
    },
    "source_refs": [
      "arenanet-api:specializations:28"
    ],
    "verification_status": "automated"
  },
  {
    "effective_patch": null,
    "fetched_at": "2026-08-14T10:19:09Z",
    "game_build_id": 205505,
    "id": 35,
    "kind": "specialization",
    "mode": "wvw",
    "names": {
      "en": "Critical Strikes",
      "zh": "致命"
    },
    "payload": {
      "background": "https://render.guildwars2.com/file/29C9C0E8F16ADC18F745CA93CB58BA0C164B5CE1/1012100.png",
      "elite": false,
      "icon": "https://render.guildwars2.com/file/1CDB2736E6CAF79A1B549B06CDED717B3418F7B1/1012024.png",
      "major_traits": [
        1209,
        1267,
        1268,
        1170,
        1272,
        1299,
        1904,
        1215,
        1702
      ],
      "minor_traits": [
        1281,
        1210,
        1282
      ],
      "profession": "Thief"
    },
    "source_refs": [
      "arenanet-api:specializations:35"
    ],
    "verification_status": "automated"
  },
  {
    "effective_patch": null,
    "fetched_at": "2026-08-14T10:19:09Z",
    "game_build_id": 205505,
    "id": 44,
    "kind": "specialization",
    "mode": "wvw",
    "names": {
      "en": "Trickery",
      "zh": "诡诈"
    },
    "payload": {
      "background": "https://render.guildwars2.com/file/00CDEB242E93EA19125E48B556D2069639D03DBF/1012104.png",
      "elite": false,
      "icon": "https://render.guildwars2.com/file/06BF06CDA7150617C5E075265C1E2F15E84B3D64/1012028.png",
      "major_traits": [
        1159,
        1252,
        1163,
        1277,
        1286,
        1190,
        1187,
        1158,
        1706
      ],
      "minor_traits": [
        1137,
        1232,
        1157
      ],
      "profession": "Thief"
    },
    "source_refs": [
      "arenanet-api:specializations:44"
    ],
    "verification_status": "automated"
  },
  {
    "effective_patch": null,
    "fetched_at": "2026-08-14T10:19:09Z",
    "game_build_id": 205505,
    "id": 54,
    "kind": "specialization",
    "mode": "wvw",
    "names": {
      "en": "Acrobatics",
      "zh": "特技"
    },
    "payload": {
      "background": "https://render.guildwars2.com/file/0CACB74F6E36F80921C6D6F2F0786B6C1CCCDCA4/1012099.png",
      "elite": false,
      "icon": "https://render.guildwars2.com/file/E109FF4E65CD3FA4AAC20E9D219C4D5207E1E461/1012023.png",
      "major_traits": [
        1112,
        1289,
        1237,
        1241,
        1192,
        1290,
        1238,
        1295,
        1703
      ],
      "minor_traits": [
        1240,
        1234,
        1242
      ],
      "profession": "Thief"
    },
    "source_refs": [
      "arenanet-api:specializations:54"
    ],
    "verification_status": "automated"
  },
  {
    "effective_patch": null,
    "fetched_at": "2026-08-14T10:19:09Z",
    "game_build_id": 205505,
    "id": 58,
    "kind": "specialization",
    "mode": "wvw",
    "names": {
      "en": "Deadeye",
      "zh": "神枪手"
    },
    "payload": {
      "background": "https://render.guildwars2.com/file/09B7D10707C7095C050B34ED68E3E3BB06626C7A/1769904.png",
      "elite": true,
      "icon": "https://render.guildwars2.com/file/F93EF1717238E9ACC1CA330D4416D324AE08585D/1769895.png",
      "major_traits": [
        2145,
        2173,
        2136,
        2118,
        2078,
        2160,
        2111,
        2093,
        2146
      ],
      "minor_traits": [
        2171,
        2172,
        2084
      ],
      "profession": "Thief",
      "profession_icon": "https://render.guildwars2.com/file/E4CDA974AF47D2336E02211E4667FE5C9579774F/1770213.png",
      "profession_icon_big": "https://render.guildwars2.com/file/2BE4F4AB7F69206BBDABB20CACB1DC7911B33F4E/1770212.png",
      "weapon_trait": 2129
    },
    "source_refs": [
      "arenanet-api:specializations:58"
    ],
    "verification_status": "automated"
  },
  {
    "effective_patch": null,
    "fetched_at": "2026-08-14T10:19:09Z",
    "game_build_id": 205505,
    "id": 71,
    "kind": "specialization",
    "mode": "wvw",
    "names": {
      "en": "Specter",
      "zh": "缚影者"
    },
    "payload": {
      "background": "https://render.guildwars2.com/file/BF7507EF23027CA6CAD12C586D7D7EAA05962249/2503613.png",
      "elite": true,
      "icon": "https://render.guildwars2.com/file/E915E494C64037C93AB53FB6F2D414B468DBCA48/2503610.png",
      "major_traits": [
        2284,
        2299,
        2275,
        2290,
        2288,
        2285,
        2264,
        2300,
        2289
      ],
      "minor_traits": [
        2184,
        2272,
        2280
      ],
      "profession": "Thief",
      "profession_icon": "https://render.guildwars2.com/file/DD5E09D55662BEBFE1CF4FA32C28E4023A2D09EB/2503666.png",
      "profession_icon_big": "https://render.guildwars2.com/file/ECC123FEEAF1B8450B017253510113E4800C34B6/2503664.png",
      "weapon_trait": 2295
    },
    "source_refs": [
      "arenanet-api:specializations:71"
    ],
    "verification_status": "automated"
  },
  {
    "effective_patch": null,
    "fetched_at": "2026-08-14T10:19:09Z",
    "game_build_id": 205505,
    "id": 77,
    "kind": "specialization",
    "mode": "wvw",
    "names": {
      "en": "Antiquary",
      "zh": "彩戏师"
    },
    "payload": {
      "background": "https://render.guildwars2.com/file/32E896AC6766E272C8910B6170394A3575C0D335/3679912.png",
      "elite": true,
      "icon": "https://render.guildwars2.com/file/569D3C9A9E7121939844809F0D05E81480C8F6F8/3679903.png",
      "major_traits": [
        2423,
        2365,
        2346,
        2400,
        2431,
        2350,
        2409,
        2393,
        2348
      ],
      "minor_traits": [
        2403,
        2337,
        2362
      ],
      "profession": "Thief",
      "profession_icon": "https://render.guildwars2.com/file/411B80D69C4324E84D9C050955B0040F66D7DFA1/3680089.png",
      "profession_icon_big": "https://render.guildwars2.com/file/97D6737DB5D2B2EE1713B906C1D41C76CCEC994A/3680087.png"
    },
    "source_refs": [
      "arenanet-api:specializations:77"
    ],
    "verification_status": "automated"
  }
]
